{
  "$schema": "http://json-schema.org/draft-07/schema#",
  "$id": "https://deme.dev/schemas/dialogue-tree.schema.json",
  "title": "DialogueTree",
  "description": "A dialogue tree entity. One entity per file, conventionally content/dialogues/<id>.json.",
  "type": "object",
  "required": ["id", "type", "rootNodeId", "nodes"],
  "properties": {
    "id": { "$ref": "common.schema.json#/definitions/entityId" },
    "type": { "const": "dialogueTree" },
    "npcId": {
      "$ref": "common.schema.json#/definitions/entityId",
      "description": "References the content/npcs/*.json entity this dialogue tree belongs to."
    },
    "rootNodeId": {
      "$ref": "common.schema.json#/definitions/entityId",
      "description": "References the id of the node in nodes[] where the dialogue starts."
    },
    "nodes": {
      "type": "array",
      "items": { "$ref": "dialogue-node.schema.json" },
      "minItems": 1
    }
  },
  "additionalProperties": false
}
